{
  "protocol": "focusir",
  "version": 1,
  "kind": "request",
  "request_id": "11111111-1111-4111-8111-111111111112",
  "session_id": "22222222-2222-4222-8222-222222222222",
  "method": "af.start",
  "lease_id": "33333333-3333-4333-8333-333333333333",
  "control_epoch": "7",
  "params": { "search_mode": "local_then_recovery" }
}
