{
  "protocol": "focusir",
  "version": 1,
  "kind": "request",
  "request_id": "11111111-1111-4111-8111-111111111111",
  "method": "session.open",
  "params": {
    "client_id": "aaaaaaaa-aaaa-4aaa-8aaa-aaaaaaaaaaaa",
    "client_name": "FocusIR.Workbench",
    "client_version": "0.1.0",
    "supported_versions": [
      1
    ],
    "workbench_tag": "FOCUSIR_FACTORY_WORKBENCH_V1"
  }
}
